{
  "schema_version": "assess-1",
  "verdict": "try",
  "item": {
    "type": "product",
    "identity": "LinkPad onboarding flow, read as of 2026-10-08",
    "resolved": true
  },
  "claims": [
    {
      "claim": "checks 10,000 links a minute",
      "evidence": "README benchmark on a 16-core machine, no method given",
      "status": "PROBABLE"
    },
    {
      "claim": "no network calls other than the links it checks",
      "evidence": "read src/main.py: no other requests",
      "status": "CONFIRMED"
    }
  ],
  "fit": {
    "goal": "keep the docs free of dead links (context file, goal 2)",
    "overlap": "the docs CI already runs lychee on every push",
    "burden": "one new CI job",
    "risks": [
      "MIT, no telemetry found"
    ],
    "cost": {
      "price": "free",
      "tier": "open source",
      "limits": "none",
      "terms": "MIT",
      "checked_at": "2026-10-08"
    }
  },
  "next_action": {
    "action": "Borrow the three-step onboarding idea for our own setup page",
    "owner": "operator",
    "done_when": "the idea card exists",
    "stop_condition": "stop after one card",
    "handoff": "harvest"
  },
  "confidence": "medium",
  "context_file": "present"
}
